,created_at,id_str,full_text,quote_count,reply_count,retweet_count,favorite_count,lang,user_id_str,conversation_id_str,username,tweet_url,image_url,location,loc1,loc2,loc3
1880,Fri Dec 08 04:06:42 +0000 2023,1732974960011030600,Warga Jabar percaya pada Ganjar karena beliau adalah pemimpin yang tidak hanya pandai berbicara  tapi juga pandai bertindak  tidak seperti Gibran yang terlalu sering membuat blunder. @sonsofartemis https://t.co/11GzHJ0xqt,0,0,0,0,in,1682240310448128000,1732974960011030600,dwisariiiiii51,https://twitter.com/dwisariiiiii51/status/1732974960011030600,,mojokerto,mojokerto,,
1881,Fri Dec 08 04:20:24 +0000 2023,1732978408198725757,Kepemimpinan Ganjar terbukti efektif  sementara Gibran terlalu banyak blunder. Warga Jabar tentu lebih memilih yang berkompeten seperti Ganjar. @whoisagam  https://t.co/ivO1Eebcxz,0,0,0,0,in,1694644977379442688,1732978408198725757,ApriliaPriliaax,https://twitter.com/ApriliaPriliaax/status/1732978408198725757,,surabaya,surabaya,,
1886,Fri Dec 08 04:21:07 +0000 2023,1732978590663524776,Ganjar membuktikan bahwa pemimpin sejati tidak perlu mencari sensasi  beda dengan Gibran yang sering membuat blunder. Warga Jabar yakin pada kepemimpinan Ganjar yang cerdas dan tulus. @uwaymstk  https://t.co/A2u4UOWNlp,0,0,0,0,in,1684775228726280192,1732978590663524776,MaulanaDonii,https://twitter.com/MaulanaDonii/status/1732978590663524776,,surabaya,surabaya,,
1888,Fri Dec 08 03:04:14 +0000 2023,1732959241437352294,Aksi Ganjar selama ini membuktikan bahwa dia adalah pemimpin yang dapat diandalkan. Tidak seperti Gibran yang sering membuat blunder  Ganjar jelas dan tegas dalam menyampaikan visi dan misinya. @kochengorennnn https://t.co/auXlHLAPh2,0,0,0,0,in,1681610021178843137,1732959241437352294,__anggitomo,https://twitter.com/__anggitomo/status/1732959241437352294,,mojokerto,mojokerto,,
1889,Fri Dec 08 04:08:43 +0000 2023,1732975467047903588,Ganjar memiliki track record yang bersih dan positif  tidak seperti Gibran yang terlalu sering membuat blunder dan kesalahan. @xysxlvixx  https://t.co/kCUoBZDHkm,0,0,0,0,in,1689837622108286976,1732975467047903588,ArloDamar,https://twitter.com/ArloDamar/status/1732975467047903588,,mojokerto,mojokerto,,
1890,Fri Dec 08 03:36:44 +0000 2023,1732967421806514512,Kami yakin Ganjar mampu memberikan solusi konkret untuk permasalahan stunting  bukan seperti Gibran yang lebih suka membuat blunder dalam setiap kesempatan. @rezedenevil  https://t.co/WLQd32qom0,0,0,0,0,in,1688473365974335488,1732967421806514512,ayncholif,https://twitter.com/ayncholif/status/1732967421806514512,,mojokerto,mojokerto,,
1895,Fri Dec 08 03:47:01 +0000 2023,1732970008987508867,Ganjar adalah pemimpin yang mampu memahami kebutuhan masyarakat Jawa Barat dan memberikan solusi yang tepat. Berbeda dengan Gibran yang terlalu sering membuat blunder tanpa memberikan kontribusi positif. Warga Jabar pasti memilih yang lebih terpercaya. https://t.co/eYQXofTLBG,0,0,0,0,in,1684448450337988608,1732970008987508867,SastraIman2,https://twitter.com/SastraIman2/status/1732970008987508867,,kediri,kediri,,
1901,Fri Dec 08 03:15:56 +0000 2023,1732962184039407779,Ganjar punya kemampuan berbicara yang jelas dan tegas  berbeda dengan Gibran yang sering membuat kesalahan dan blunder. Warga Jabar pasti lebih percaya pada pemimpin yang bisa menyampaikan visinya dengan jelas. @jemaukuliah https://t.co/wguJzIDa7u,0,0,0,0,in,1679800634298753026,1732962184039407779,hhusein_jamil,https://twitter.com/hhusein_jamil/status/1732962184039407779,,"batu, indonesia",batu,indonesia,
1902,Fri Dec 08 03:15:57 +0000 2023,1732962188963586260,Ganjar udah membuktikan dirinya sebagai pemimpin yang kompeten  bukan seperti Gibran yang suka buat blunder Warga Jabar yakin Ganjar bisa membawa perubahan positif @lahfa_sf  https://t.co/Bn3IV2Ufp2,0,0,0,0,in,1688571585672941568,1732962188963586260,mohakbar32,https://twitter.com/mohakbar32/status/1732962188963586260,,surabaya,surabaya,,
1913,Fri Dec 08 03:06:46 +0000 2023,1732959880313802854,Ganjar memiliki track record yang bersih dan tidak pernah terlibat dalam blunder-blunder seperti yang sering dilakukan oleh Gibran @lils_lilo  https://t.co/Yq55JO9SA9,0,0,0,0,in,1694617177339621376,1732959880313802854,defarantiara,https://twitter.com/defarantiara/status/1732959880313802854,,malang,malang,,
1916,Mon Dec 11 06:32:51 +0000 2023,1734098903648354328,@DewiMarsin39 @AndriGenio87 @liputan6dotcom susah jadi timsesnya nyapuin blunder Gibran,0,1,0,0,in,1703373679739179008,1733813080453496991,dewi_tissak,https://twitter.com/dewi_tissak/status/1734098903648354328,,"malang, jawa timur",malang,jawa timur,
1922,Mon Dec 11 00:24:16 +0000 2023,1734006148125339988,@Paltiwest Aku kok meliat setiap kali Gibran melakukan blunder mulai dari MK  isu debat  asam sulfat lalu terakhir pidato cuma 2 menit  pasti akan muncul hasil survey yg ratingnya tinggi. Silahkan diperhatiin,0,0,0,0,in,1233778263157116929,1733917055165018532,Bastenjiggle,https://twitter.com/Bastenjiggle/status/1734006148125339988,,"kota surabaya, jawa timur",kota surabaya,jawa timur,
1923,Fri Dec 08 04:06:38 +0000 2023,1732974943040942563,Warga Jabar yakin  dengan Ganjar sebagai pemimpin  kita tidak akan dihadapkan pada blunder-blunder yang tidak perlu seperti yang sering dilakukan oleh Gibran. @Sumancay  https://t.co/oheGREDkgo,0,0,0,0,in,1681936027718680577,1732974943040942563,_davidchandra14,https://twitter.com/_davidchandra14/status/1732974943040942563,,malang,malang,,
1927,Fri Dec 08 04:06:41 +0000 2023,1732974955657372069,Warga Jabar tahu bahwa Ganjar adalah pemimpin yang konsisten dalam membawa perubahan positif  tidak seperti Gibran yang terus melakukan blunder. @Sugarzl06  https://t.co/z1qMHMIYl5,0,0,0,0,in,1679761728085843969,1732974955657372069,DwiSusanto_7,https://twitter.com/DwiSusanto_7/status/1732974955657372069,,surabaya,surabaya,,
1931,Fri Dec 08 01:45:23 +0000 2023,1732939398117999048,@xquitavee @gibran_tweet Ada yg blunder mslh asam sulfat juga? ðŸ¤”,0,0,0,0,in,185494358,1732602667250352583,MonYayasan,https://twitter.com/MonYayasan/status/1732939398117999048,,"kota surabaya, jawa timur",kota surabaya,jawa timur,
1932,Fri Dec 08 04:06:30 +0000 2023,1732974910614671611,Warga Jabar yakin  dengan Ganjar sebagai pemimpin  kita tidak akan terjebak dalam blunder seperti yang dilakukan oleh Gibran. @sulaemanmy  https://t.co/nypYRMt0SL,0,0,0,0,in,1681522002463703041,1732974910614671611,__airasyahputri,https://twitter.com/__airasyahputri/status/1732974910614671611,,batu,batu,,
1933,Fri Dec 08 03:11:02 +0000 2023,1732960950280761787,Ganjar memberikan kesan yang lebih tenang dan rasional dalam setiap kesempatan  tidak seperti Gibran yang terlalu sering terprovokasi dan membuat blunder. Warga Jabar membutuhkan pemimpin yang bisa menjaga kestabilan. @lucaswon9 https://t.co/6zMPQdm1jh,0,0,0,0,in,1689905140936179713,1732960950280761787,baskorohend,https://twitter.com/baskorohend/status/1732960950280761787,,blitar,blitar,,
1937,Thu Nov 16 14:35:11 +0000 2023,1725160591482831031,@narkosun Gibran: â€œDaripada gue blunder  njirâ€,0,0,0,0,in,621792120,1725154106434580666,GalPraa,https://twitter.com/GalPraa/status/1725160591482831031,,"kota surabaya, jawa timur",kota surabaya,jawa timur,
1940,Wed Dec 06 07:16:19 +0000 2023,1732297905338548485,Udah kayak minum obat 1x4. Gibran sekali kampanye 4 blunder  Cleopatra Asam Sulfat Ade Armando KOPI GRATIS Belimbing https://t.co/sQ5B2IGYFW,0,0,0,1,in,1344992219652997121,1732297905338548485,RokhanaSti,https://twitter.com/RokhanaSti/status/1732297905338548485,https://pbs.twimg.com/ext_tw_video_thumb/1732297827177709568/pu/img/bf2FBypAJoRiLy-F.jpg,"jember, jawa timur",jember,jawa timur,
1941,Tue Dec 05 15:08:21 +0000 2023,1732054308332732596,"Salah benar &amp; kalah menang urusan belakangan Target picik"" mereka adalah membungkam aiman untuk sementara waktu &amp; menyibukkannya dg ""dagelan hukum"" sampai pilpres selesai.  Ini bisa jadi blunder besar bagi rezim Jokowi pendukung Prabowo Gibran""",0,0,0,0,in,817910306382852096,1732054308332732596,Prasety44990944,https://twitter.com/Prasety44990944/status/1732054308332732596,,"kediri, indonesia",kediri,indonesia,
1942,Wed Dec 06 21:09:54 +0000 2023,1732507680395477026,@drReUtari08 @gibran_tweet @prabowo 6. Sering blunder 7. Pongah (pak Prabowo  saya sdh disini) 8. Menabrak aturan  seperti: menyogok makanan  Baliho diistimewakan 9. Tdk bisa debat  aturan mau dirubah cukup visi-misi  Rakyat tidak suka semua itu  apalagi milenial  tentu idealismenya tinggi. Begitulah adanya.,0,0,0,0,in,1603768816189988865,1732305771067785385,rangkutifuat,https://twitter.com/rangkutifuat/status/1732507680395477026,,"kota surabaya, jawa timur",kota surabaya,jawa timur,
1943,Thu Dec 07 06:49:51 +0000 2023,1732653629918884089,@tempodotco Mungkin kalo saya jadi gibran  bakal ngelakuin hal yv sama  ðŸ¤£  Buat menghindari banyak blunder  dan ketidak mampuan menjelaskan.  Ntar jadi rame lagi kayak asam sulfat ðŸ¤£,0,0,0,0,in,386920271,1732561699306402012,rizzalabdi,https://twitter.com/rizzalabdi/status/1732653629918884089,,probolinggo,probolinggo,,
1945,Sat Dec 09 08:43:27 +0000 2023,1733406995305410827,Yang GAK YAKIN adalah mereka yang usia muda. Gencarkan issue HAM dalam sebulan saja. Nyungsep tuch Prabowo.,1,5,24,61,in,99743594,1733406995305410827,ike_hw71,https://twitter.com/ike_hw71/status/1733406995305410827,,"malang, jawa timur",malang,jawa timur,
1946,Tue Dec 12 14:13:36 +0000 2023,1734577241961730331,Setuju dengan Pak Wiranto si aku  udah ga heran dengan pihak2 yang terus memunculkan dugaan pelanggaran HAM oleh Prabowo cuma muncul menjelang pilpres aja. https://t.co/SJKlkG3oIo,0,1,4,4,in,870742633139666944,1734577241961730331,nitnotw,https://twitter.com/nitnotw/status/1734577241961730331,https://pbs.twimg.com/media/GBJ0zmRbsAAijs_.jpg,"kota surabaya, jawa timur",kota surabaya,jawa timur,
1949,Tue Dec 12 13:12:40 +0000 2023,1734561909540876726,@PartaiSocmed Masalah HAM &amp; papua prabowo lebih mengutamakan asumsi daripada solusi dan doi terlihat emosi dengan tanggapan paslon yg lain. Butuh minum asam sulfat?,0,4,3,71,in,868004863,1734558699329380676,yanpanjie,https://twitter.com/yanpanjie/status/1734561909540876726,,"malang, jawa timur",malang,jawa timur,
1950,Mon Dec 11 14:06:58 +0000 2023,1734213185266479470,Natalius Pigai: Prabowo Bersih dari Tuduhan Pelanggaran HAM https://t.co/W7lLLnuc8h,0,2,0,1,in,848614550,1734213185266479470,e100ss,https://twitter.com/e100ss/status/1734213185266479470,,"kota surabaya, jawa timur",kota surabaya,jawa timur,
1951,Tue Dec 12 05:32:42 +0000 2023,1734446153289302020,Pemimpin seharusnya teladan  bukan pelanggar HAM seperti Prabowo @faizalassegaf  Menolak Lupa https://t.co/7N5c34Zb32,0,0,0,0,in,1714140578664062976,1734446153289302020,Andriianakbarr,https://twitter.com/Andriianakbarr/status/1734446153289302020,https://pbs.twimg.com/media/GBH9lH6bIAAZ3ZV.jpg,probolinggo,probolinggo,,
1952,Wed Dec 13 06:04:04 +0000 2023,1734816435996901707,dikira jd presiden cmn ttg jaminan hukum doang ya  pemilih prabowo ga paham dirinya pelaku HAM @alfredstfu  Gemoy Penculik tangkap prabowo https://t.co/FL3j5Xg2eK,0,0,0,0,in,1713816982422966272,1734816435996901707,mikopngstuu,https://twitter.com/mikopngstuu/status/1734816435996901707,https://pbs.twimg.com/ext_tw_video_thumb/1734816411468570624/pu/img/SmxeXCYjuN5fFK_m.jpg,kediri,kediri,,
1953,Wed Dec 13 05:40:53 +0000 2023,1734810603187999134,duh debat kemaren prabowo pelaku HAM mau jaga HAM mana ngotak @Alfin_FR1  Gemoy Penculik tangkap prabowo https://t.co/5bbp8VCHYd,0,0,0,0,in,1713823909009883136,1734810603187999134,dindavaniatinaa,https://twitter.com/dindavaniatinaa/status/1734810603187999134,https://pbs.twimg.com/ext_tw_video_thumb/1734810572255100928/pu/img/R3sP4J1CU_V5G5Ee.jpg,madiun,madiun,,
1954,Fri Dec 08 02:32:29 +0000 2023,1732951249862185142,lambat laun Prabowo bisa saja turun inget ya kasus HAM gitu loh mau diungkit-ungkit lagi apa gimana @JokorhHidayat  Menolak lupa https://t.co/ip0pN3h0wd,0,0,0,0,in,1712788774953086977,1732951249862185142,AnandaDwitamiii,https://twitter.com/AnandaDwitamiii/status/1732951249862185142,https://pbs.twimg.com/media/GAyt-SAbAAAhddS.png,probolinggo,probolinggo,,
1955,Tue Dec 12 14:36:18 +0000 2023,1734582954695995433,anjir nyerang pengadilan ham ke pak prabowo padahal dia sendiri di wðŸ˜‡ðŸ˜‡,0,4,0,3,in,1579669846735802368,1734582954695995433,Icad4U,https://twitter.com/Icad4U/status/1734582954695995433,,"kota surabaya, jawa timur",kota surabaya,jawa timur,
1956,Sat Dec 09 02:19:16 +0000 2023,1733310313276273086,Prabowo harus bertanggung jawab pd keluarga korban @hanszanikov  Capres Pelanggar HAM https://t.co/EjtbsHH88R,0,0,0,0,in,1712788774953086977,1733310313276273086,AnandaDwitamiii,https://twitter.com/AnandaDwitamiii/status/1733310313276273086,https://pbs.twimg.com/media/GA30imkbcAAlciE.jpg,probolinggo,probolinggo,,
1957,Sun Dec 10 02:39:21 +0000 2023,1733677756498477349,Masa lalu yang kelam seharusnya menjadi batasan bagi ambisi politik Prabowo. @ana877963220336  Pelanggar HAM https://t.co/6YK7J8S09k,0,0,0,0,in,1715003831153807360,1733677756498477349,jessicaannaaa,https://twitter.com/jessicaannaaa/status/1733677756498477349,https://pbs.twimg.com/media/GA9CuwIbAAAJl-0.jpg,mojokerto,mojokerto,,
1958,Wed Dec 13 07:28:28 +0000 2023,1734837675872628832,Prabowo yang pernah bobrok sama pelanggaran HAM  masa iya kita mau negara dipegang orangÂ kayakÂ gitu? @amerhazzim  Gemoy Penculik tangkap prabowo https://t.co/TdXufemfLG,0,0,0,0,in,1712788774953086977,1734837675872628832,AnandaDwitamiii,https://twitter.com/AnandaDwitamiii/status/1734837675872628832,https://pbs.twimg.com/ext_tw_video_thumb/1734837645501702144/pu/img/Cxs2FINjIEDEIHOV.jpg,probolinggo,probolinggo,,
1959,Sun Dec 10 03:03:05 +0000 2023,1733683726826254362,Pencalonan Prabowo adalah ejekan terhadap korban pelanggaran HAM.@YaniljKuswandar  Pelanggar HAM https://t.co/c38bGZordP,0,0,0,0,in,1713823909009883136,1733683726826254362,dindavaniatinaa,https://twitter.com/dindavaniatinaa/status/1733683726826254362,https://pbs.twimg.com/media/GA9IKB2akAAUgFP.jpg,madiun,madiun,,
1960,Sat Dec 09 02:16:46 +0000 2023,1733309682708791790,Prabowo capres yg hancurkan moral bangsa @putrianasih2402  Capres Pelanggar HAM https://t.co/BnER0645Tf,0,0,0,0,in,1712790877272440832,1733309682708791790,putradaniiii,https://twitter.com/putradaniiii/status/1733309682708791790,https://pbs.twimg.com/media/GA3z95cbsAAujA-.jpg,surabaya,surabaya,,
1961,Tue Dec 12 13:08:28 +0000 2023,1734560853385506968,MC: topik pertama adalah HAM  Prabowo: https://t.co/uXC2Q0t6vS,0,0,0,0,in,1079821749875748864,1734560853385506968,rijbrian,https://twitter.com/rijbrian/status/1734560853385506968,https://pbs.twimg.com/tweet_video_thumb/GBJl5dXaAAAJgL5.jpg,"kota malang, jawa timur",kota malang,jawa timur,
1962,Sun Dec 10 02:44:26 +0000 2023,1733679033907609844,Prabowo seolah-olah meremehkan martabat rakyat dengan mencalonkan diri. @NMarinkah  Pelanggar HAM https://t.co/5OyWnelXmx,0,0,0,0,in,1715017123339390977,1733679033907609844,hanaltfhaja,https://twitter.com/hanaltfhaja/status/1733679033907609844,https://pbs.twimg.com/media/GA9D5LnaoAAu12o.jpg,batu,batu,,
1963,Fri Dec 08 23:34:10 +0000 2023,1733268762139472164,Prabowo? Dia TNI yang diberhentikan tanpa hormat  jangan biarkan ia memimpin @let_telolet PELANGGAR HAM https://t.co/Flp8eicR8v,0,0,0,0,in,1716734840119451648,1733268762139472164,freyaulia,https://twitter.com/freyaulia/status/1733268762139472164,https://pbs.twimg.com/media/GA3Ov6haQAAjDnz.jpg,batu,batu,,
1964,Wed Dec 13 02:00:53 +0000 2023,1734755236575887536,prabowo percuma ngomongamakan ham klo track recordnya ga mendukung @Aki_Taku17  Gemoy Penculik tangkap prabowo https://t.co/jUkwAAdrWX,0,0,0,0,in,1712393339247656960,1734755236575887536,AngkasavS,https://twitter.com/AngkasavS/status/1734755236575887536,https://pbs.twimg.com/media/GBMWsDjbUAABFtb.jpg,probolinggo,probolinggo,,
1965,Sun Dec 10 03:05:34 +0000 2023,1733684353530831191,Catatan kelam membuat Prabowo tidak pantas jadi pemimpin negara.@HasnadyHutasoit  Pelanggar HAM https://t.co/iFyEEXjfHc,0,0,0,0,in,1713816982422966272,1733684353530831191,mikopngstuu,https://twitter.com/mikopngstuu/status/1733684353530831191,https://pbs.twimg.com/media/GA9IuiuagAASTry.jpg,kediri,kediri,,
1966,Tue Dec 12 13:55:37 +0000 2023,1734572718740132252,Apakah ini bentuk ketidakpedulian Prabowo pada isu HAM @macaronchocos Gemoy Penculik TangkapPRABOWO https://t.co/EzPHbIxw3U,0,0,0,0,in,1716734840119451648,1734572718740132252,freyaulia,https://twitter.com/freyaulia/status/1734572718740132252,https://pbs.twimg.com/media/GBJwsNuaMAADvZR.jpg,batu,batu,,
1967,Wed Dec 13 07:19:07 +0000 2023,1734835322960445792,Gimana bisa percaya sama Prabowo  masa lupa sama dosa pelanggaran HAM yang pernah dia lakukan? @ambiya_mohammad  Gemoy Penculik tangkap prabowo https://t.co/YxzsZSkmOh,0,0,0,0,in,1712790877272440832,1734835322960445792,putradaniiii,https://twitter.com/putradaniiii/status/1734835322960445792,https://pbs.twimg.com/ext_tw_video_thumb/1734835291331121152/pu/img/6ukpR_UwQc8EflCP.jpg,surabaya,surabaya,,
1969,Tue Dec 12 14:01:20 +0000 2023,1734574158325891174,Memilih prabowo sama saja dengan mengabaikan rasa keadilan bagi para korban HAM @lynn_nnyl_ Gemoy Penculik TangkapPRABOWO https://t.co/gwwZ5kzNG4,0,0,0,0,in,1712393339247656960,1734574158325891174,AngkasavS,https://twitter.com/AngkasavS/status/1734574158325891174,https://pbs.twimg.com/media/GBJyAHJbgAAiAdd.jpg,probolinggo,probolinggo,,
1970,Sun Dec 10 05:15:04 +0000 2023,1733716941083390061,Ganjar - Mahfud dipercayai sebagai sosok yang bersih dan jujur  tanpa catatan pelanggaran HAM seperti Prabowo. @RiyantoRiy24988  https://t.co/vuV9A3XkpX,0,0,0,0,in,1686971314815598592,1733716941083390061,fauzanliandi1,https://twitter.com/fauzanliandi1/status/1733716941083390061,,blitar,blitar,,
1971,Tue Dec 12 02:13:52 +0000 2023,1734396117083975748,Lha yg pecat Prabowo krn pelanggaran HAM kan anda pak. Masa sih negara sebesar ini harus dipimpin seorang penculik dan pelanggar HAM. Sejatinya dlm Islam  memilih seorang pemimpin itu dilihat masa lalunya  bukan janji2 kampanye nya pak,0,0,0,0,in,3048559530,1734396117083975748,Ary_Satupank,https://twitter.com/Ary_Satupank/status/1734396117083975748,,surabaya,surabaya,,
1972,Mon Dec 11 05:48:44 +0000 2023,1734087802948899205,@joko_maryadi @mjaya2007 @xquitavee Tanya juga tuh ke Mahfud MD  klo prabowo adalah pelanggar HAM  kok bisa pak Mahfud jd timses prabowo di Pilpres 2014??,0,1,0,0,in,1607378277014065154,1733123980201267525,ChallsOfrivia,https://twitter.com/ChallsOfrivia/status/1734087802948899205,,"kota surabaya, jawa timur",kota surabaya,jawa timur,
1973,Sun Dec 10 11:28:46 +0000 2023,1733810986472415669,"@savicali Y nek wes di adili  artine wis nglakoni ukumane! Opo maneh?   Nek nyangkem HAM (Prabowo) gur 5 Tahunan  Kuwi jenenge duduk Aktivis/peduli HAM  tapi TIMSES  jeneng liane maneh TAEKKKK""""",0,8,0,2,in,1695117647393030144,1733777941774123182,akalMulus,https://twitter.com/akalMulus/status/1733810986472415669,,"kota surabaya, jawa timur",kota surabaya,jawa timur,
1974,Wed Dec 13 02:06:00 +0000 2023,1734756523229012201,Yaallah guys kok masih ada yang dukung Pak Prabowo yg ceramah soal atasi masalah HAM melupakan fakta sejarah @Aldian70550914  Gemoy Penculik tangkap prabowo https://t.co/krpTey14kP,0,0,0,0,in,1712762841173037056,1734756523229012201,arkantegarr,https://twitter.com/arkantegarr/status/1734756523229012201,https://pbs.twimg.com/media/GBMX2-qa8AAA8_U.jpg,probolinggo,probolinggo,,
1975,Tue Dec 12 15:49:55 +0000 2023,1734601482685886640,Selesaikan HAM Prabowo bukan pro terhadap HAM @AididHaziq  Gemoy Penculik  VisiPakbowo KeadilanYgPasti  Jelas MasBowoGibran Tegas https://t.co/UB4NPJBeys,0,0,0,0,in,1712790877272440832,1734601482685886640,putradaniiii,https://twitter.com/putradaniiii/status/1734601482685886640,https://pbs.twimg.com/media/GBKK2nRa8AAiyaA.jpg,surabaya,surabaya,,
1977,Sun Dec 10 07:45:16 +0000 2023,1733754742923505993,Prabowo  meskipun mengaku gemoy  terlibat dalam pelanggaran HAM pada masa lalu. @HaqqLis  https://t.co/rvVpmqh5hy,0,0,0,0,in,1684095030024376320,1733754742923505993,ghinaulyaaaaa,https://twitter.com/ghinaulyaaaaa/status/1733754742923505993,,madiun,madiun,,
1979,Sun Dec 10 07:07:03 +0000 2023,1733745123740307941,Prabowo  meskipun mencoba mengaku gemoy  tetap terbayang oleh keterlibatannya dalam pelanggaran HAM. @PapaOyen89  https://t.co/zzMw61FJrE,0,0,0,0,in,1681942543947431936,1733745123740307941,amaliah_bilqis,https://twitter.com/amaliah_bilqis/status/1733745123740307941,,mojokerto,mojokerto,,
1980,Sun Dec 10 07:48:53 +0000 2023,1733755649090343299,Prabowo  yang mengaku gemoy  ternyata terlibat dalam pelanggaran HAM yang tidak bisa diabaikan @meawmeawyou_  https://t.co/GGBqd4bpqQ,0,0,0,0,in,1694970696018055168,1733755649090343299,NurdinAliif,https://twitter.com/NurdinAliif/status/1733755649090343299,,blitar,blitar,,
1981,Wed Dec 13 02:08:14 +0000 2023,1734757088814125516,prabowo  kamu jaga HAM tapi pelanggaran HAM sejarahmu menanti @akbar_sugar  Gemoy Penculik tangkap prabowo https://t.co/2qzM3LylIX,0,0,0,0,in,1712788774953086977,1734757088814125516,AnandaDwitamiii,https://twitter.com/AnandaDwitamiii/status/1734757088814125516,https://pbs.twimg.com/media/GBMYX08bcAAbZ5g.jpg,probolinggo,probolinggo,,
1982,Wed Dec 13 01:21:00 +0000 2023,1734745200319496703,Dulu hormat sama mas Budiman..Idealis Perubahan haluan masuk timses Prabowo...beda politik Ketika membela Prabowo atas pelanggaran HAM dengan alasan tugas negara.. Jadi muak.. Segampang itu nyawa seseorang dihilangkan.. https://t.co/sq3A60zMyD,0,0,0,0,in,1215449295794524161,1734745200319496703,Snpth_Tomporejo,https://twitter.com/Snpth_Tomporejo/status/1734745200319496703,https://pbs.twimg.com/media/GBMNkBSbEAARJeV.jpg,"malang, jawa timur",malang,jawa timur,
1983,Tue Dec 12 14:37:40 +0000 2023,1734583302575853819,ganjar basi banget nyerang prabowo pakai kasus ham. ini siapa sih tim nya. harusnya ga secetek itu nyiapin materinya,0,0,0,0,in,78586839,1734583302575853819,shigaruu,https://twitter.com/shigaruu/status/1734583302575853819,,surabaya,surabaya,,
1984,Mon Dec 11 04:54:18 +0000 2023,1734074102275846411,Pemimpin seperti Ganjar-Mahfud memahami bahwa keberagaman politik adalah kekayaan  bukan ancaman seperti yang terlihat pada kasus Prabowo-Gibran. @Yuniawa29  LanjutGan https://t.co/Qxy6qxGCEu,0,0,0,0,in,1682292187076386816,1734074102275846411,rahmanandi40708,https://twitter.com/rahmanandi40708/status/1734074102275846411,,malang,malang,,
1985,Mon Dec 11 04:33:23 +0000 2023,1734068840961859690,Kepemimpinan Ganjar-Mahfud adalah jawaban atas kebutuhan akan pemimpin yang dapat mempersatukan  bukan memecah belah  seperti yang terjadi pada kasus kepala desa yang tidak mendukung Prabowo-Gibran. @poddiumid LanjutGan https://t.co/pj3hZoOrUI,0,0,0,0,in,1683772385789636609,1734068840961859690,NasuFarhan,https://twitter.com/NasuFarhan/status/1734068840961859690,,madiun,madiun,,
1986,Mon Dec 11 04:30:46 +0000 2023,1734068182241980804,Kejujuran dan integritas Ganjar-Mahfud adalah kunci untuk membangun kepercayaan  berbeda dengan ketidakpercayaan yang muncul dalam kasus kepala desa dan politik Prabowo-Gibran. @NHastom LanjutGan https://t.co/H3sZpKEjAE,0,0,0,0,in,1681936027718680577,1734068182241980804,_davidchandra14,https://twitter.com/_davidchandra14/status/1734068182241980804,,malang,malang,,
1987,Sat Dec 09 04:01:07 +0000 2023,1733335944462533107,Ini akan melumpuhkan kekuatan Jokowi dalam cawe2 Pilpres. Utk memenangkan Prabowo-Gibran. Dg kasus Butet ini  Penguasa sekarang tidak akan direkom  oleh rakyat. Artinya  kasus Butet ini samahalnya mengarahkan pilihan masyarakat ke paslon bukan no 2.,0,0,0,0,in,1659149724,1733335944462533107,ImamJumhuri,https://twitter.com/ImamJumhuri/status/1733335944462533107,,sidoarjo-indonesia,sidoarjo-indonesia,,
1988,Thu Dec 07 03:26:50 +0000 2023,1732602540473430041,masih belum move on dari kasus kemarin jadi gamau milih prabowo atau gibran relatable banget sih ini emng gaes @SyahriniszNasyi  Gibran Duta Asam Sulfat https://t.co/S3oS8DJ9GR,0,0,0,0,in,1712790877272440832,1732602540473430041,putradaniiii,https://twitter.com/putradaniiii/status/1732602540473430041,https://pbs.twimg.com/media/GAtw0u8aMAAaYFx.jpg,surabaya,surabaya,,
1989,Mon Dec 11 05:38:07 +0000 2023,1734085132506808354,@Heraloebss Orang2 kuat yg dukung Prabowo - Gibran kayaknya banyak yg abis kasus sama KPK tapi mandeg kelanjutannya,0,0,0,0,in,1191268020900941824,1734008598366408932,helmbiruku,https://twitter.com/helmbiruku/status/1734085132506808354,,"kota surabaya, jawa timur",kota surabaya,jawa timur,
1990,Tue Dec 05 23:57:29 +0000 2023,1732187467544137995,Gibran Rakabuming Raka menanggapi Cak Imin yang berjanji mengembalikan independensi KPK. Prabowo-Gibran ingin KPK fokus pada pencegahan  bukan hanya penindakan kasus.,0,0,0,0,in,1676135678403571713,1732187467544137995,tatisuharti01,https://twitter.com/tatisuharti01/status/1732187467544137995,,madiun,madiun,,
1998,Sun Dec 10 05:22:10 +0000 2023,1733718729262047272,@herupurnom0 @gibran_tweet @cakimiNOW @aniesbaswedan Cara membaca hasil survei nya anda salah.  Persentase SUKA itu dari yang menjawab TAHU.  Di kasus prof MMD dari 64%an yg tahu beliau  sebanyak 75%an Suka.,0,2,0,0,in,24893875,1733705984345071961,ferrykoto,https://twitter.com/ferrykoto/status/1733718729262047272,,"kota surabaya, jawa timur",kota surabaya,jawa timur,
1999,Tue Dec 12 13:50:44 +0000 2023,1734571491445076128,Wiranto ngomongin urgensi menyelesaikan kasus Prabowo masih diem aja  nggak mau klarifikasi? @Madridista_zack Gemoy Penculik TangkapPRABOWO https://t.co/ruqqbyQGfU,0,0,0,0,in,1712798654862647296,1734571491445076128,Firahandayanih,https://twitter.com/Firahandayanih/status/1734571491445076128,https://pbs.twimg.com/media/GBJvkyGb0AAp1mE.jpg,madiun,madiun,,
