"created_at","id_str","full_text","quote_count","reply_count","retweet_count","favorite_count","lang","user_id_str","conversation_id_str","username","tweet_url","image_url","location"
"Wed Dec 06 04:21:13 +0000 2023","1732253838265237897","idolaku semua Prabowo-Gibran pemimpin yang dekat dan memikirkan rakyat #GibranMendengar https://t.co/PzCdCOuJL7","1","27","147","43","in","870742633139666944","1732253838265237897","nitnotw","https://twitter.com/nitnotw/status/1732253838265237897","https://pbs.twimg.com/media/GAozrvZaEAAb8nQ.jpg","Kota Surabaya, Jawa Timur"
"Tue Dec 05 16:01:51 +0000 2023","1732067771524186150","Kok gak diundang sih anak nepo sama @tvOneNews  ?  Jangan gitulah caranya  Gibran jg punya hak untuk tampil di acara ini  katanya idola Milenial &amp; sosok yg mewakili kaum muda  malah gak diundang https://t.co/Zgo5qzWQsd","6","63","84","276","in","1417525464248184832","1732067771524186150","naaooollll","https://twitter.com/naaooollll/status/1732067771524186150","https://pbs.twimg.com/media/GAmKdXlakAAeHdc.jpg","Kota Malang, Jawa Timur"
"Sun Dec 10 02:29:59 +0000 2023","1733675395931894086","@dapitnih @vaniepink Gibran masih kalah survey.. surveynya diulang terus","2","7","35","802","in","37595056","1733667306298044481","mas_mto","https://twitter.com/mas_mto/status/1733675395931894086","","Malang, Jawa Timur"
"Wed Dec 06 14:49:54 +0000 2023","1732412053217058908","Blimbing Sayur Gibran Rakabuming gak berani datang  takut dirujak dibikin sayur asam sulfat😅🤭🤭 https://t.co/2Q3xze4FvP","0","1","1","13","in","1404631725670486020","1732412053217058908","tukangrosok_22","https://twitter.com/tukangrosok_22/status/1732412053217058908","https://pbs.twimg.com/ext_tw_video_thumb/1732411013969108992/pu/img/iOayfxcLl2LvoRrX.jpg","Malang, Jawa Timur"
"Thu Dec 07 05:28:11 +0000 2023","1732633080203235526","Sampe hari ini   tema kampanye :   Paslon 1 : perubahan  tolak IKN  Indonesia bahaya kalau mereka kalah.  Paslon 2 : Keberlanjutan Hilirisasi  Gemoy z Makan siang &amp;susu gratis   Paslon 3 : Prabowo  Jokowi   Gibran   Iriana  PSI   Kecurangan   Sepertinya akan begitu sampe pemilu .","2","52","40","125","in","1197213380525707264","1732633080203235526","bentangnegeri","https://twitter.com/bentangnegeri/status/1732633080203235526","","Kota Surabaya, Jawa Timur"
"Wed Dec 06 14:20:45 +0000 2023","1732404717668782481","GOOOOO !!! https://t.co/vPFSS9ONiW","1","0","1","2","und","1241216144125480970","1732404717668782481","GibranLeander","https://twitter.com/GibranLeander/status/1732404717668782481","https://pbs.twimg.com/media/GAq83p6bkAEaVgW.jpg","Kota Malang, Jawa Timur"
"Wed Dec 06 17:12:55 +0000 2023","1732448041897259091","Calon lain berdebat tentang cara meraih SUARA Milenial Dan Gen Z di forum kaku. Lalu  merasa lebih ngerti tentang Generasi ini .  GIBRAN BE LIKE ; https://t.co/mz20oroEpT","5","43","19","79","in","1197213380525707264","1732448041897259091","bentangnegeri","https://twitter.com/bentangnegeri/status/1732448041897259091","https://pbs.twimg.com/ext_tw_video_thumb/1732448016710463491/pu/img/AYmuPdugAoOhN1Pj.jpg","Kota Surabaya, Jawa Timur"
"Tue Dec 05 06:00:44 +0000 2023","1731916494643306839","Mantap Peningkatan Ekonomi Solo Di Bawah Walikota Gibran  #GibranMendengar https://t.co/AiKqywB7Qn","0","0","5","6","in","968946160130904064","1731916494643306839","fkomjen","https://twitter.com/fkomjen/status/1731916494643306839","https://pbs.twimg.com/media/GAkA35QbEAA-6EK.jpg","Kota Surabaya, Jawa Timur"
"Fri Dec 08 00:18:32 +0000 2023","1732917540911972395","Saya masih ada kemungkinan pilih capres yang mana saja.   Karena bagi saya: - Anies Baswedan - Muhaimin Iskandar - Prabowo Subianto - Gibran Rakabuming Raka - Ganjar Pranowo - Mahfud MD semuanya saya yakini adalah orang baik.  Sehingga ketika kita tak memilih 2 paslon yang lain …","8","58","30","218","in","185156524","1732917540911972395","hasyimmah","https://twitter.com/hasyimmah/status/1732917540911972395","","Mojokerto"
"Thu Dec 07 06:20:10 +0000 2023","1732646161918668923","@genx36545403 @prabowo @gibran_tweet @jokowi @alextham878 @Alie_Fahnoor @AlmaghribiS @AndreasSolusi @are_inismyname @BANGSAygSUJUD @Bank_Joee_ @bengkeldodo @Chaves1305 @florieliciouss Awokawok https://t.co/jxhPpohDJM","0","2","3","12","in","1440914340022865921","1732410908637589794","Nurhadi40083478","https://twitter.com/Nurhadi40083478/status/1732646161918668923","https://pbs.twimg.com/ext_tw_video_thumb/1732645831277436928/pu/img/HJSjhPSn7ZMB-YEe.jpg",""
"Sat Dec 09 11:44:35 +0000 2023","1733452579374592136","Sementara itu..  8000 Pendukung A### di Jakarta beralih dukung Prabowo~Gibran  alasannya lebih sejahtera...  Kalian memang berpikirnya sangat rasional 😃😃✌✌✌  https://t.co/jwTbVUoBiI","2","5","2","12","in","1625830843251056641","1733452579374592136","njsusilo","https://twitter.com/njsusilo/status/1733452579374592136","","Kota Surabaya, Jawa Timur"
"Tue Dec 05 06:04:03 +0000 2023","1731917330135835135","#GibranMendengar sebagai pemimpin baliau juga mendengarkan keluh kesah masyarakat  @gibran_tweet https://t.co/v2bMfOzapY","0","0","6","7","in","929167899150901249","1731917330135835135","anlyelir","https://twitter.com/anlyelir/status/1731917330135835135","https://pbs.twimg.com/media/GAkBoeGaMAAVA_8.jpg","Kota Surabaya, Jawa Timur"
"Thu Dec 07 15:19:01 +0000 2023","1732781768925913206","I secretly wished this is (jokingly  of course) how Gibran will shut Anies remark on debate. Then  Prabowo will dance as soon as Gibran shut his mouth.","0","0","0","1","en","369983210","1732781768925913206","dikanchut","https://twitter.com/dikanchut/status/1732781768925913206","","Surabaya, Jawa Timur"
"Sat Dec 09 13:30:29 +0000 2023","1733479227863990629","@Menu_Dasi @gibran_tweet @prabowo @ganjarpranowo Gassspol..🤟  #GasssGanjarMahfud","0","1","1","1","en","2884352413","1733469598731952195","cak_agoest","https://twitter.com/cak_agoest/status/1733479227863990629","","Kota Surabaya, Jawa Timur"
"Thu Dec 07 06:14:17 +0000 2023","1732644681241317794","@TeddGus @prabowo @gibran_tweet Diwarnai dg tangisan  mudah2 an gk  ngompol juga  🤣🤣🤣 https://t.co/pIhE7WxvkY","0","1","7","93","in","1440914340022865921","1732578942476062853","Nurhadi40083478","https://twitter.com/Nurhadi40083478/status/1732644681241317794","https://pbs.twimg.com/ext_tw_video_thumb/1732644652606726144/pu/img/IIMX2B35xJqpkmgP.jpg",""
"Mon Dec 11 00:54:49 +0000 2023","1734013835051499998","Prabowo Bandingkan Gibran dengan Jenderal Soedirman  https://t.co/qwn5xlqHLP","4","20","0","10","in","848614550","1734013835051499998","e100ss","https://twitter.com/e100ss/status/1734013835051499998","","Kota Surabaya, Jawa Timur"
"Tue Dec 12 13:57:48 +0000 2023","1734573267153989824","Nonton #DebatCapres2023 cuma nungguin Gibran ngomong. Siapa yg sama hayoo😂","0","0","0","0","in","98831535","1734573267153989824","aldoncorleone","https://twitter.com/aldoncorleone/status/1734573267153989824","","SMAN 2 Surabaya"
"Wed Dec 13 02:29:25 +0000 2023","1734762419275399400","gibran","0","1","0","0","en","96136106","1734762419275399400","freeiphone10s","https://twitter.com/freeiphone10s/status/1734762419275399400","","Malang indonesia"
"Wed Dec 06 13:57:22 +0000 2023","1732398830971470157","la ndi @gibran_tweet https://t.co/Ccs8AExeJ1","0","0","0","0","tl","995433132760285184","1732398830971470157","omzzaid","https://twitter.com/omzzaid/status/1732398830971470157","https://pbs.twimg.com/media/GAq3jFaawAEu0dG.jpg","Malang"
"Wed Dec 13 10:03:12 +0000 2023","1734876615136731463","Hujan   susu coklat panas   Gibran Alcorcer 🎹 🤍","0","0","0","1","in","1118492337846439936","1734876615136731463","fajrinark_","https://twitter.com/fajrinark_/status/1734876615136731463","",""
"Wed Dec 13 11:43:09 +0000 2023","1734901770860867732","@jacobs_beu @nongandah @gibran_tweet Memang punya rasa itu? Lawong etika aja dilanggar.. awowowoookkkkk","0","0","1","1","in","2172321512","1734596720603136222","ishak1509","https://twitter.com/ishak1509/status/1734901770860867732","","Sidoarjo, Indonesia"
"Sun Dec 10 13:26:32 +0000 2023","1733840624225526255","Keberanian Gibran dalam membawa perubahan dinilai positif oleh masyarakat Surabaya. @Faizulabid14  https://t.co/NGCglyO2Ji","0","0","0","0","in","1678783184920776712","1733840624225526255","SRukyo","https://twitter.com/SRukyo/status/1733840624225526255","","Surabaya"
"Mon Dec 11 08:03:23 +0000 2023","1734121690026930524","Prabowo-Gibran Unggul Signifikan dari Pesaingnya Berdasarkan Survei Litbang Kompas https://t.co/FhRbicWW0k","0","1","0","5","in","848614550","1734121690026930524","e100ss","https://twitter.com/e100ss/status/1734121690026930524","","Kota Surabaya, Jawa Timur"
"Sat Dec 09 13:02:25 +0000 2023","1733472168498102577","@gibran_tweet Salam 🤟🤟🤟 https://t.co/ETOEsaUglX","0","0","0","0","in","1440914340022865921","1733294018275262732","Nurhadi40083478","https://twitter.com/Nurhadi40083478/status/1733472168498102577","https://pbs.twimg.com/media/GA6Hvn1boAApIAX.jpg",""
"Wed Dec 13 00:11:51 +0000 2023","1734727797879554200","@Muhammad_Saewad @aniesbaswedan @cakimiNOW @prabowo @gibran_tweet @ganjarpranowo @mohmahfudmd Amin","0","0","0","0","en","1031211556216791040","1734592794877202609","Fauzimuhamat2","https://twitter.com/Fauzimuhamat2/status/1734727797879554200","","Blitar, Jawa Timur"
"Sun Dec 10 13:42:31 +0000 2023","1733844647699767312","KGB SURABAYA SELALU HOREG  SEBAGAI SEMANGAT TUK CALON PRESIDEN R I 2024. 2029  PRABOWO  GIBRAN https://t.co/GbWZc5FeX3","0","0","0","1","in","1665765106893078529","1733844647699767312","TasriefH4579","https://twitter.com/TasriefH4579/status/1733844647699767312","https://pbs.twimg.com/ext_tw_video_thumb/1733844590816628736/pu/img/PcItAsA92IpuvsjD.jpg",""
"Mon Dec 11 16:55:46 +0000 2023","1734255665533837550","Pada Desember 2023 ini survei menemukan pasangan nomor urut 2 Prabowo-Gibran itu tingkat elektabilitasnya atau dukungan masyarakat ada di angka 45 6 persen #PSGibranSemakinDiDepan https://t.co/pAhB8cilWE","0","0","2","2","in","870742633139666944","1734255665533837550","nitnotw","https://twitter.com/nitnotw/status/1734255665533837550","","Kota Surabaya, Jawa Timur"
"Wed Dec 13 15:04:40 +0000 2023","1734952482110124305","Prabowo pilih Gibran  apakah ini langkah revolusioner atau malah menuju teater politik? @simple_dong  https://t.co/oHkWao6Yk0","0","0","0","0","in","1676821209093378048","1734952482110124305","khaernafeb","https://twitter.com/khaernafeb/status/1734952482110124305","","Probolinggo"
"Wed Dec 06 15:10:31 +0000 2023","1732417241692660153","Ini beneran ya? Trus klo nunggu arahan pak Jokowi. Gibran ini sebagai ap ya? https://t.co/srLBvj3Bnk","0","0","0","1","in","986277638078529536","1732417241692660153","GosongImam","https://twitter.com/GosongImam/status/1732417241692660153","https://pbs.twimg.com/ext_tw_video_thumb/1732417221815939072/pu/img/V0MDWnHryhPFQ0gV.jpg","Klakah, Indonesia"
"Mon Dec 11 16:54:51 +0000 2023","1734255437116235956","Jika membandingkan data elektabilitas per paslon dengan hasil survei sebelumnya pada Oktober. Menurutnya  paslon Prabowo-Gibran dan AMIN mengalami peningkatan suara  sedangkan Ganjar-Mahfud cenderung menurun #PSGibranSemakinDiDepan https://t.co/ZKypNnHqjM","0","0","2","2","in","870742633139666944","1734255437116235956","nitnotw","https://twitter.com/nitnotw/status/1734255437116235956","","Kota Surabaya, Jawa Timur"
"Wed Dec 13 11:38:32 +0000 2023","1734900607784485203","Keberpihakan pada rakyat yang nyata  seperti yang diterapkan oleh Gibran  menciptakan pemimpin yang dapat dipegang teguh oleh masyarakat @atet21102083  https://t.co/0zPyr7zgw2","0","0","0","0","in","1676486432498802688","1734900607784485203","wenisolihat20","https://twitter.com/wenisolihat20/status/1734900607784485203","","Mojokerto"
"Sun Dec 10 07:04:58 +0000 2023","1733744597434871848","Belum ada bukti kalau Gibran bisa membawa perubahan positif @Ajevannazar Rekam Jejak Prabowo https://t.co/3uvhrQDdAs","0","0","0","0","in","1712790877272440832","1733744597434871848","putradaniiii","https://twitter.com/putradaniiii/status/1733744597434871848","https://pbs.twimg.com/ext_tw_video_thumb/1733744549066145792/pu/img/deBizbzJdmoWABqi.jpg","Surabaya"
"Wed Dec 06 10:33:50 +0000 2023","1732347609006952458","syarat dukung Gibran itu harus absen ya! https://t.co/zYUFrpo8Gd","0","0","0","0","in","1712393339247656960","1732347609006952458","AngkasavS","https://twitter.com/AngkasavS/status/1732347609006952458","https://pbs.twimg.com/media/GAqI9zLaIAA2Adg.jpg","Probolinggo"
"Mon Dec 11 16:54:01 +0000 2023","1734255228139233377","Dalam survei menemukan bahwa pasangan nomor 2 Prabowo-Gibran itu angka elektabilitasnya atau dukungan masyarakatnya ada di 45 6%. Kemudian disusul oleh Ganjar-Mahfud 23 8%  Anies-Muhaimin yaitu 22 3%  #PSGibranSemakinDiDepan https://t.co/ZKypNnHqjM","0","0","2","2","in","870742633139666944","1734255228139233377","nitnotw","https://twitter.com/nitnotw/status/1734255228139233377","","Kota Surabaya, Jawa Timur"
"Wed Dec 06 10:26:22 +0000 2023","1732345730155847930","Wah serius tanpa Gibran debat ini jadi hambar https://t.co/32Zi58GI7j","0","0","0","0","in","1712788774953086977","1732345730155847930","AnandaDwitamiii","https://twitter.com/AnandaDwitamiii/status/1732345730155847930","https://pbs.twimg.com/media/GAqHQd8akAABUYe.jpg","Probolinggo"
"Sun Dec 10 13:58:29 +0000 2023","1733848665729667566","Prabowo-Gibran dianggap sebagai simbol harapan baru bagi masyarakat Surabaya. @flownsparks  https://t.co/zX4NONMDOS","0","0","0","0","in","1675442918558154752","1733848665729667566","dian_katriya","https://twitter.com/dian_katriya/status/1733848665729667566","","Madiun"
"Sun Dec 10 14:18:58 +0000 2023","1733853819442954341","Masyarakat Jateng yakin bahwa Prabowo-Gibran dapat menciptakan lapangan kerja yang lebih banyak. @masmauw  https://t.co/9frtRR3DxV","0","0","0","0","in","1678695529042292736","1733853819442954341","TonSuwirno","https://twitter.com/TonSuwirno/status/1733853819442954341","","Madiun"
"Tue Dec 05 08:35:51 +0000 2023","1731955529419981306","@convomf Gibran","0","0","0","0","en","1571684326173188101","1731951850629521632","AsamAminoCoffee","https://twitter.com/AsamAminoCoffee/status/1731955529419981306","","Kota Malang, Jawa Timur"
